{
      "Name": "TestSuite-ProfileTest-DetectPassThrough100",
      "Description": "Simple pass through detector to baseline MRE performance. With 100 output attributes.",
      "Class": "Featurer",
      "ExecutionType": "Sync",
      "SupportedMediaType": "Video",
      "ContentGroups": [
        "All"
      ],
      "ExecuteLambdaQualifiedARN": "arn:aws:lambda:AWS_REGION:AWS_ACCOUNT_ID:function:DetectPassThrough100:$LATEST",
      "OutputAttributes": {
        "Label": {
          "Description": "N/A"
        },    
        "Attribute1": {"Description": "A dummy attribute"},
        "Attribute2": {"Description": "A dummy attribute"},
        "Attribute3": {"Description": "A dummy attribute"},
        "Attribute4": {"Description": "A dummy attribute"},
        "Attribute5": {"Description": "A dummy attribute"},
        "Attribute6": {"Description": "A dummy attribute"},
        "Attribute7": {"Description": "A dummy attribute"},
        "Attribute8": {"Description": "A dummy attribute"},
        "Attribute9": {"Description": "A dummy attribute"},
        "Attribute10": {"Description": "A dummy attribute"},
        "Attribute11": {"Description": "A dummy attribute"},
        "Attribute12": {"Description": "A dummy attribute"},
        "Attribute13": {"Description": "A dummy attribute"},
        "Attribute14": {"Description": "A dummy attribute"},
        "Attribute15": {"Description": "A dummy attribute"},
        "Attribute16": {"Description": "A dummy attribute"},
        "Attribute17": {"Description": "A dummy attribute"},
        "Attribute18": {"Description": "A dummy attribute"},
        "Attribute19": {"Description": "A dummy attribute"},
        "Attribute20": {"Description": "A dummy attribute"},
        "Attribute21": {"Description": "A dummy attribute"},
        "Attribute22": {"Description": "A dummy attribute"},
        "Attribute23": {"Description": "A dummy attribute"},
        "Attribute24": {"Description": "A dummy attribute"},
        "Attribute25": {"Description": "A dummy attribute"},
        "Attribute26": {"Description": "A dummy attribute"},
        "Attribute27": {"Description": "A dummy attribute"},
        "Attribute28": {"Description": "A dummy attribute"},
        "Attribute29": {"Description": "A dummy attribute"},
        "Attribute30": {"Description": "A dummy attribute"},
        "Attribute31": {"Description": "A dummy attribute"},
        "Attribute32": {"Description": "A dummy attribute"},
        "Attribute33": {"Description": "A dummy attribute"},
        "Attribute34": {"Description": "A dummy attribute"},
        "Attribute35": {"Description": "A dummy attribute"},
        "Attribute36": {"Description": "A dummy attribute"},
        "Attribute37": {"Description": "A dummy attribute"},
        "Attribute38": {"Description": "A dummy attribute"},
        "Attribute39": {"Description": "A dummy attribute"},
        "Attribute40": {"Description": "A dummy attribute"},
        "Attribute41": {"Description": "A dummy attribute"},
        "Attribute42": {"Description": "A dummy attribute"},
        "Attribute43": {"Description": "A dummy attribute"},
        "Attribute44": {"Description": "A dummy attribute"},
        "Attribute45": {"Description": "A dummy attribute"},
        "Attribute46": {"Description": "A dummy attribute"},
        "Attribute47": {"Description": "A dummy attribute"},
        "Attribute48": {"Description": "A dummy attribute"},
        "Attribute49": {"Description": "A dummy attribute"},
        "Attribute50": {"Description": "A dummy attribute"},
        "Attribute51": {"Description": "A dummy attribute"},
        "Attribute52": {"Description": "A dummy attribute"},
        "Attribute53": {"Description": "A dummy attribute"},
        "Attribute54": {"Description": "A dummy attribute"},
        "Attribute55": {"Description": "A dummy attribute"},
        "Attribute56": {"Description": "A dummy attribute"},
        "Attribute57": {"Description": "A dummy attribute"},
        "Attribute58": {"Description": "A dummy attribute"},
        "Attribute59": {"Description": "A dummy attribute"},
        "Attribute60": {"Description": "A dummy attribute"},
        "Attribute61": {"Description": "A dummy attribute"},
        "Attribute62": {"Description": "A dummy attribute"},
        "Attribute63": {"Description": "A dummy attribute"},
        "Attribute64": {"Description": "A dummy attribute"},
        "Attribute65": {"Description": "A dummy attribute"},
        "Attribute66": {"Description": "A dummy attribute"},
        "Attribute67": {"Description": "A dummy attribute"},
        "Attribute68": {"Description": "A dummy attribute"},
        "Attribute69": {"Description": "A dummy attribute"},
        "Attribute70": {"Description": "A dummy attribute"},
        "Attribute71": {"Description": "A dummy attribute"},
        "Attribute72": {"Description": "A dummy attribute"},
        "Attribute73": {"Description": "A dummy attribute"},
        "Attribute74": {"Description": "A dummy attribute"},
        "Attribute75": {"Description": "A dummy attribute"},
        "Attribute76": {"Description": "A dummy attribute"},
        "Attribute77": {"Description": "A dummy attribute"},
        "Attribute78": {"Description": "A dummy attribute"},
        "Attribute79": {"Description": "A dummy attribute"},
        "Attribute80": {"Description": "A dummy attribute"},
        "Attribute81": {"Description": "A dummy attribute"},
        "Attribute82": {"Description": "A dummy attribute"},
        "Attribute83": {"Description": "A dummy attribute"},
        "Attribute84": {"Description": "A dummy attribute"},
        "Attribute85": {"Description": "A dummy attribute"},
        "Attribute86": {"Description": "A dummy attribute"},
        "Attribute87": {"Description": "A dummy attribute"},
        "Attribute88": {"Description": "A dummy attribute"},
        "Attribute89": {"Description": "A dummy attribute"},
        "Attribute90": {"Description": "A dummy attribute"},
        "Attribute91": {"Description": "A dummy attribute"},
        "Attribute92": {"Description": "A dummy attribute"},
        "Attribute93": {"Description": "A dummy attribute"},
        "Attribute94": {"Description": "A dummy attribute"},
        "Attribute95": {"Description": "A dummy attribute"},
        "Attribute96": {"Description": "A dummy attribute"},
        "Attribute97": {"Description": "A dummy attribute"},
        "Attribute98": {"Description": "A dummy attribute"},
        "Attribute99": {"Description": "A dummy attribute"},
        "Attribute100": {"Description": "A dummy attribute"}
      }
    }