{
      "Name": "TestSuite-EventTest-LabelPassThrough",
      "Description": "A way to baseline framework latency with a trivial labeling task.",
      "Class": "Labeler",
      "ExecutionType": "Sync",
      "SupportedMediaType": "Video",
      "ContentGroups": [
        "All"
      ],
      "ExecuteLambdaQualifiedARN": "arn:aws:lambda:AWS_REGION:AWS_ACCOUNT_ID:function:LabelPassThrough:$LATEST"      
}